start	end	speaker	text	keep
1420.321	1429.674		I found the distinctions between the different employee types and the represented versus non-represented really interesting.	
1429.734	1432.738		And I just wanted to ask, can we get	
1432.955	1447.437		 those numbers broken down by the different employee types that you mentioned at the beginning of the spreadsheet because you had a couple of different departments in their bus operations, rail operations, et cetera, et cetera, et cetera.	
1448.199	1460.177		I would just be fascinated to look at, not just represented versus non-represented, but among our different types of employees, is there a meaningful difference in	
1460.157	1470.655		 the key drivers of what they're looking for is their difference in, for example, fair compensation being an issue in some departments over others.	
1470.695	1479.05		So just, is that something that you could provide to board members a bit more granular breakdown of those numbers?	
1480.232	1480.933		Mr. McKay.	
1481.504	1482.485		 Thank you, Mr. Chair.	
1482.525	1485.768		I would say that the employees are saying that that is an important factor.	
1485.808	1487.589		They're not saying that that's an issue right now.	
1487.609	1491.613		I just want to make that distinction that we ask them to rank there at the most important characteristics.	
1491.633	1495.076		That's not to say that somebody is disappointed with their current salary.	
1495.096	1500.982		They're just saying that is an important employment characteristic just to make that draw that specific line.	
1501.002	1510.93		And as far as more granular data, if you have specific asks about, if you can tell me which one you're interested in the most are a few of them, we can delve into that data.	
1511.051	1511.511		Thank you.	
1511.98	1512.32		 Awesome.	
1512.341	1513.122		I'll send you an email.	
1515.285	1517.748		Madam CEO, I saw your hand go up and then it went down.	
1517.869	1518.67		Did that get covered?	
1520.072	1520.592		Yes, it did.	
1520.613	1534.793		And I was just going to put in a different element as well, recognizing as we talk about this, considering that we do bargain for wages with two thirds of our workforce and considering the time at which this was done, that could be a factor as well.	
1534.833	1539.64		But Mr. McKay answered the question is best suited, which I believe addressed my concerns as well.	
1539.981	1541.683		Not my concerns, my response.	
1542.507	1542.807		 Great.	
1543.729	1544.37		Director Catlin.	
1546.893	1550.038		Thank you, Mr. Chair, and I am a GMCEO Johnson.	
1550.098	1553.262		I appreciate your context for that.	
1553.723	1559.291		I just wanted to say I reviewed this over the weekend and I was really encouraged.	
1559.591	1562.976		I thought the trend was very, very positive.	
1562.996	1570.927		So I just wanted to say I appreciate the further explanation today, but I just wanted to say that this looked really good.	
1571.027	1571.468		Thank you.	
1573.169	1573.69		 Mr. McKay.	
1574.771	1580.097		If you like these results, just wait till you hear the customer and community results on the meeting on the 23rd, just a plug for the next meeting.	
1583.441	1584.862		Vice Chair Guzman is your turn.	
1586.324	1588.527		Thank you, Chair Guzman.	
1588.607	1590.509		Thank you very much for the presentation.	
1590.929	1597.557		My question, is there any sort of target for the survey participation?	
1600.068	1602.592		 Not a target per se, Mr. Chair, if I may.	
1602.612	1602.872		Please.	
1603.473	1604.174		Not a target per se.	
1604.194	1611.724		We like to see, you know, a couple of years ago, we had a 47 percent rate, and that's incredible.	
1612.646	1619.976		Jake Studemeyer, who's also on this call, he has said that both private and public sector, 20 to 30 percent is considered good.	
1620.056	1621.779		So we're over 30 percent.	
1621.879	1622.86		That's fantastic.	
1622.88	1627.847		We have heard from people in the open-ended comments at the end that they're feeling a little bit of survey fatigue.	
1628.047	1636.977		 So there is an opportunity perhaps in 2026 to maybe do a smaller scale or just to make sure that we're still hitting the same the same.	
1638.618	1648.409		Stuff that you know the strategic plan elements as long as we're capturing those things somehow we'll talk about that internally to figure out how best we can we can roll out a different survey next year.	
1650.571	1651.132		OK, thank you.	
1651.172	1657.699		Yeah, I mean, I just I feel like 32% a little low and I would love to.	
1658.59	1672.871		 see us somehow, you know, creatively think about how can we improve that number, whether it's like a departmental competition and the department with the highest participation percentage gets a pizza party.	
1673.031	1681.364		You know, it's something I just, I feel like there's opportunity to improve that even though 30 to, you know, 20, 30% is considered good.	
1682.926	1683.467		Madam CEO.	
1684.072	1684.853		 Yes, thank you.	
1684.893	1694.722		I was going to have Mr. Studermeyer expound, but before I do that, recognizing the vice chair's comments, we do have full fledged engagement and recognizing you are talking about incentivizing individuals.	
1695.082	1705.572		We do give giveaways, we give food, we do a lot of different things and recognizing that the intent behind garnering as much feedback as we can, considering the two thirds of our workforce are out on the front lines.	
1705.632	1711.598		We intentionally, as Mr. McKay said, do that during the bid selection process with their work shifts.	
1711.578	1716.383		 and recognizing that we want to see a greater representation.	
1716.403	1733.28		This is statistically valid, and I was just going to offer, and being on a public agency space, this response rate is heading shoulders above the crowd, recognizing that other agencies, and this is from my own experience, working at six other transit agencies beside this one, really is something to applaud.	
1733.84	1738.345		Mr. Studemeyer, you want to expand referencing the participation rate	
1738.865	1739.586		 Absolutely.	
1739.646	1740.007		Thank you.	
1740.688	1746.698		So, again, having nearly a third of our workforce taking the survey is great.	
1747.48	1748.562		Good is one word to use it.	
1748.822	1750.305		Getting up close to a third is great.	
1751.527	1752.789		It's a fine balance.	
1752.809	1756.315		I understand the want and the desire to have more participation.	
1756.355	1758.679		Again, more participation is always good.	
1758.659	1760.301		 It is a fine balance, though.	
1761.322	1766.989		When you start to push for more and more completion, it can drive something similar to the Hawthorne effect.	
1767.25	1777.362		If anyone's familiar with psychology and research, folks alter their responses when they know they're being watched or being pushed towards something.	
1777.402	1786.253		So if you're really, really, really heavy on participation, it can actually drive up feelings of paranoia or concern like, why are they wanting so much participation?	
1786.233	1799.411		 So again, not that there isn't more that we can do to encourage participation, but again, it is a very fine balance between encouraging participation and, you know, mandating participation for lack of a better word.	
1803.617	1804.538		All right, Director Bezek.	
1805.9	1806.44		Thanks very much.	
1806.48	1807.522		Thanks for the presentation.	
1807.802	1815.733		With regard to the participation, my guess without any scientific background is much like Google reviews, right?	
1815.899	1816.44		 I'm happy.	
1816.46	1817.561		I'm not going to participate.	
1817.821	1818.502		I'm unhappy.	
1818.562	1821.065		I'm going on Google and I'm giving you one stock.	
1821.085	1824.029		So maybe the lack of participation says something.	
1824.149	1833.06		But overall, I think the improvement that we're seeing over these several years is really all down to GM CEO Johnson and her team.	
1833.801	1840.629		And I'm not surprised that it takes time because as we all know, when change is implemented, people get there, you know, that people don't like it.	
1841.45	1843.813		But then as time goes on and they see that the changes are good,	
1844.553	1847.644		 then they realize that it was the right thing to do and they're much happier.	
1847.684	1850.936		So I think that's what we're seeing here when we look at this over a period of time.	
1850.956	1854.951		So hats off to you, GM CEO Johnson, thanks for the presentation.	
1858.542	1859.884		 Okay, thank you.	
1860.245	1874.106		I want to tell you I was happy to see this because safe and happy employees make safe and happy customers in the same way that safe and happy baristas make safe and happy customers at my other job.	
1874.126	1880.196		So I am excited to see the correlation and what's coming up with customer experience surveys.	
1880.446	1882.068		 in a couple of weeks.	
1882.389	1888.138		So, gentlemen, thank you, and thank you for keeping the presentation tight so we can move on to other matters.	
1888.498	1889.179		Thank you so much.	
1890.401	1894.487		Are there any other matters to discuss before we move into the executive session?	
1896.47	1897.071		Chair Buque.	
1898.148	1898.989		 Yeah, thank you very much.	
1899.029	1899.73		Share Guzman.	
1900.491	1902.614		I just wanted to take this moment real quick.	
1903.655	1907.82		Yesterday, there appeared to be an anti-Semitic attack that occurred in Boulder.	
1908.882	1919.515		I just want to say that the heart of this agency, the heart of this board go out to you, Director Geisinger, your constituents, Boulder community,	
1919.495	1924.501		 the Jewish community not only here in Colorado, but the Jewish community is all across the world.	
1925.322	1939.118		So I just wanted to acknowledge that as an agency that, again, as we mentioned during our executive committee a couple of weeks ago, you can't fight hate with hate.	
1939.639	1943.583		Love always wins in the long run and that this agency's heart is with all of you.	
1943.904	1944.304		Thank you.	
1949.667	1950.047		 Thank you.	
1954.773	1956.435		Sorry, I have to hold space for a minute.	
1957.436	1958.938		Are there any other matters to discuss?	
1962.121	1962.402		All right.	
1963.102	1968.489		As a reminder, our next meeting will be Monday, June 23rd at 830 a.m.	
1968.849	1973.194		At that meeting, we are set to discuss the results of our customer and community surveys.	
1976.347	1990.182		 In a moment, the committee will meet in executive session to further our dialogue with the general manager CEO regarding her performance in meeting the agency values for and based off duties and the progress towards her 2025 short term goals.	
1991.264	1998.692		I would like to append the motion to move into executive session to state that the performance committee will be deemed adjourned.	
1999.195	2001.179		 after it adjourns into the executive session.	
2001.7	2007.954		For public transparency, this means that once the committee moves into executive session, the main meeting will be adjourned.	
2008.755	2012.884		I will now entertain a motion to move into executive session to discuss the following.	
2013.792	2027.553		 pursuant to Section 24-6-402, Open Paran-4, Close Paran, Open Paran-F, Close Paran, Open Paran-I, Close Paran of the Colorado Revised Statutes.	
2028.014	2032.24		For consideration of personnel matters regarding the Board's dialogue	
2032.22	2044.452		 with the general manager and CEO on her performance in meeting the agency values core based job duties and progress towards her 2025 short term goals and input from the board of directors on the same.	
2044.492	2046.954		Do I have a motion?	
2047.555	2048.296		Music.	
2049.477	2049.777		Second.	
2051.298	2054.141		I have music as the movement and Caitlin as the second.	
2055.262	2058.025		Are there any no votes on this action?	
2062.038	2066.264		 Seeing none, then our regular session is adjourned at 904am.	
2066.665	2070.611		Directors, please move over to the executive session.	
2070.871	2071.953		Oh, sorry, Melanie.	
2073.075	2078.603		Okay, please move over to the executive session and allow a few minutes for everybody to move over.	
2078.943	2079.304		Thank you.	
